{
  "$schema": "https://json-schema.org/draft/2020-12/schema",
  "$id": "https://amap-spec/schemas/peer-statement.schema.json",
  "title": "peer-statement",
  "description": "runtime -> runtime: the signed statement that carries a peer message between hosts. AMAP, section \"Peer Traffic Between Hosts\". The sending runtime signs the statement's exact UTF-8 bytes with Ed25519 and ships both in one AMAP-Peer-Statement header field (section \"Carriage, and the Candidate the Verifier Sees\"); the receiving runtime verifies the signature over the received bytes before parsing, then validates against this schema. CLOSED at every level, unlike the runtime-authored notices: these are signed bytes another runtime acts on, a member the receiver does not know is a member it cannot bind to what it publishes, and the version member `v` is the only evolution path. A statement that fails this schema fails verification, and the message is demoted to mail (sections \"Verification\" and \"Outcomes\"). Numbers are lexical integers (no fraction or exponent) and strings contain no unpaired surrogate (section \"The Statement\", checked at check 5(b) of section \"Verification\"); the schema cannot express either, nor calendar validity, interval order, the entropy of `id`, or any binding to the message: those are the verification steps of section \"Verification\".",
  "type": "object",
  "additionalProperties": false,
  "required": [
    "v",
    "key_id",
    "kind",
    "id",
    "from",
    "to",
    "ts",
    "subject",
    "body_sha256",
    "attachments"
  ],
  "properties": {
    "v": {
      "type": "integer",
      "const": 1
    },
    "key_id": {
      "type": "string",
      "description": "names one key in the signing peer's configured key set; opaque, unique within that set, 1-64 characters.",
      "pattern": "^[A-Za-z0-9][A-Za-z0-9._-]{0,63}(?!\\n)$"
    },
    "kind": {
      "const": "peer"
    },
    "id": {
      "type": "string",
      "minLength": 1,
      "description": "the peer message id (section \"Correlation and Replies\"), bare. A sending runtime mints it under ^[A-Za-z0-9_][A-Za-z0-9_-]*$ (hex, or base64url re-minted if it would start with '-'): the notice_id charset without '.', so its Message-ID encoding <id@domain> is a valid msg-id (section \"The Statement\"); the receiver publishes it as message.id.",
      "pattern": "^[A-Za-z0-9_][A-Za-z0-9_-]*(?!\\n)$"
    },
    "in_reply_to": {
      "type": "string",
      "minLength": 1,
      "description": "the peer message id this message answers (section \"Correlation and Replies\"), bare, minted by the other runtime under the same pattern. Absent on a fresh task. Resolved against the receiver's ledger with the participants bound (section \"Correlation and Edges Between Hosts\").",
      "pattern": "^[A-Za-z0-9_][A-Za-z0-9_-]*(?!\\n)$"
    },
    "from": {
      "type": "string",
      "minLength": 1,
      "description": "bare addr-spec of the sending agent; its domain MUST be one of the signing peer's configured domains.",
      "pattern": "^[A-Za-z0-9!#$%&'*+/=?^_`{|}~.-]+@[A-Za-z0-9.-]+(?!\\n)$"
    },
    "to": {
      "type": "string",
      "minLength": 1,
      "description": "bare addr-spec of the one receiving agent (section \"Addressing\": a peer message is addressed to one agent).",
      "pattern": "^[A-Za-z0-9!#$%&'*+/=?^_`{|}~.-]+@[A-Za-z0-9.-]+(?!\\n)$"
    },
    "ts": {
      "type": "string",
      "description": "when the sending runtime signed: RFC 3339 UTC, whole seconds, upper-case T and Z, no offset. MUST be a real calendar instant (section \"The Statement\").",
      "pattern": "^[0-9]{4}-[0-9]{2}-[0-9]{2}T[0-9]{2}:[0-9]{2}:[0-9]{2}Z(?!\\n)$"
    },
    "subject": {
      "type": "string",
      "description": "the subject the receiver publishes as message.subject; no control characters.",
      "pattern": "^[^\u0000-\u001f]*(?!\\n)$"
    },
    "body_sha256": {
      "type": "string",
      "description": "SHA-256 of the UTF-8 encoding of the body_text the receiver will publish, lower-case hex.",
      "pattern": "^[a-f0-9]{64}(?!\\n)$"
    },
    "attachments": {
      "type": "array",
      "description": "one entry per attachment, in order; empty when there are none.",
      "items": {
        "type": "object",
        "additionalProperties": false,
        "required": [
          "sha256",
          "size_bytes",
          "filename",
          "media_type"
        ],
        "properties": {
          "sha256": {
            "type": "string",
            "pattern": "^[a-f0-9]{64}(?!\\n)$"
          },
          "size_bytes": {
            "type": "integer",
            "minimum": 0
          },
          "filename": {
            "type": "string",
            "minLength": 1
          },
          "media_type": {
            "type": "string",
            "minLength": 1
          }
        }
      }
    },
    "sender_exposure": {
      "type": "object",
      "additionalProperties": false,
      "description": "section \"Sender Exposure\", asserted by the sending runtime; omitted when it made no assessment. Timestamps in ts's format; window_start <= window_end; last_external_delivery_ts present iff external_mail_delivered is true, and then within the window; asserted_by is the signing runtime's configured runtime address (section \"The Statement\"; checks 5(b) and 8 of section \"Verification\").",
      "required": [
        "asserted_by",
        "external_mail_delivered",
        "window_start",
        "window_end"
      ],
      "properties": {
        "asserted_by": {
          "type": "string",
          "minLength": 1,
          "pattern": "^[A-Za-z0-9!#$%&'*+/=?^_`{|}~.-]+@[A-Za-z0-9.-]+(?!\\n)$"
        },
        "external_mail_delivered": {
          "type": "boolean"
        },
        "window_start": {
          "type": "string",
          "pattern": "^[0-9]{4}-[0-9]{2}-[0-9]{2}T[0-9]{2}:[0-9]{2}:[0-9]{2}Z(?!\\n)$"
        },
        "window_end": {
          "type": "string",
          "pattern": "^[0-9]{4}-[0-9]{2}-[0-9]{2}T[0-9]{2}:[0-9]{2}:[0-9]{2}Z(?!\\n)$"
        },
        "last_external_delivery_ts": {
          "type": "string",
          "pattern": "^[0-9]{4}-[0-9]{2}-[0-9]{2}T[0-9]{2}:[0-9]{2}:[0-9]{2}Z(?!\\n)$"
        },
        "derived_from": {
          "type": "array",
          "items": {
            "type": "string",
            "minLength": 1,
            "pattern": "^[A-Za-z0-9_][A-Za-z0-9_.-]*(?!\\n)$"
          }
        }
      },
      "if": {
        "required": [
          "external_mail_delivered"
        ],
        "properties": {
          "external_mail_delivered": {
            "const": true
          }
        }
      },
      "then": {
        "required": [
          "last_external_delivery_ts"
        ]
      }
    },
    "sender_since": {
      "type": "string",
      "description": "OPTIONAL (section \"Optional: Sender Age, and Deployment Admission Policy\"): when the sending runtime first enrolled the sending agent's identity (as that runtime defines identity), from its durable registry; same format as ts and not later than ts. A runtime assertion, not a sender claim. Never reset for a continuation of the same identity (restart, rebind, re-creation, key rotation); a new enrolment starts a new value. A receiver enforcing a sender age keeps the last value per (runtime, from) and refuses an earlier one as inconsistent. Absence means NOT ASSERTED, never 'new'.",
      "pattern": "^[0-9]{4}-[0-9]{2}-[0-9]{2}T[0-9]{2}:[0-9]{2}:[0-9]{2}Z(?!\\n)$"
    }
  }
}
