{
  "v": 1,
  "key_id": "test2",
  "kind": "peer",
  "id": "b7e21d04c9f84a6a9c3e0f5d2a81c6b3",
  "from": "builder@host-c.fleet.example",
  "to": "planner@host-a.fleet.example",
  "ts": "2026-10-09T15:00:00Z",
  "subject": "Re: Run the conformance suite",
  "body_sha256": "5d8741a3ffbcebf497b16768823b335b0fc2aac0e6e1ddbc0f84acf205572d98",
  "attachments": [
    {
      "sha256": "2ce053aea3eea2710bcbfc0bbe8ff6dbcdaafb5eae97b7eb5006f75124b3ff01",
      "size_bytes": 36,
      "filename": "gate.log",
      "media_type": "text/plain"
    }
  ],
  "in_reply_to": "4f0c9a2e7b1d4c83a6e5f2b9d0c17e48"
}
